{"$meta": {"generated": "2026-07-26T18:00:00Z", "methodologyVersion": "1.0", "sources": [{"name": "Companies House Free Company Data + PSC + accounts bulk", "url": "https://download.companieshouse.gov.uk/", "retrieved": "2026-07-26", "licence": "Public register data"}, {"name": "ONS / NOMIS (business counts, demography, BRES, ASHE)", "url": "https://www.nomisweb.co.uk/", "retrieved": "2026-07-26", "licence": "OGL v3"}, {"name": "The Gazette", "url": "https://www.thegazette.co.uk/", "retrieved": "2026-07-26", "licence": "OGL v3"}, {"name": "FSA Food Hygiene Rating Scheme", "url": "https://ratings.food.gov.uk/", "retrieved": "2026-07-26", "licence": "OGL v3, FSA attribution"}, {"name": "Innovate UK funded projects", "url": "https://www.ukri.org/publications/innovate-uk-funded-projects-since-2004/", "retrieved": "2026-07-26", "licence": "OGL v3"}, {"name": "Charity Commission register extract", "url": "https://register-of-charities.charitycommission.gov.uk/", "retrieved": "2026-07-26", "licence": "OGL v3"}, {"name": "CQC care directory", "url": "https://www.cqc.org.uk/", "retrieved": "2026-07-26", "licence": "OGL v3"}, {"name": "Council transparency spending (17 Lancashire bodies)", "url": "https://tompickup.co.uk/lgr/", "retrieved": "2026-07-26", "licence": "OGL v3 per council"}, {"name": "ONSPD", "url": "https://geoportal.statistics.gov.uk/", "retrieved": "2026-07-26", "licence": "OGL; contains OS and Royal Mail data, Crown copyright"}], "notes": ["Transparency spending covers payments over \u00a3500 and is not a complete account of any body's budget.", "Derived indicators are Observatory assessments from public data; see the method page."]}, "officialBenchmark": [{"slug": "blackburn-with-darwen", "highGrowthPct": 4.0, "year": 2024, "englandPct": 5.0}, {"slug": "blackpool", "highGrowthPct": 4.7, "year": 2024, "englandPct": 5.0}, {"slug": "burnley", "highGrowthPct": 2.7, "year": 2024, "englandPct": 5.0}, {"slug": "chorley", "highGrowthPct": 5.9, "year": 2024, "englandPct": 5.0}, {"slug": "fylde", "highGrowthPct": 7.4, "year": 2024, "englandPct": 5.0}, {"slug": "hyndburn", "highGrowthPct": 3.0, "year": 2024, "englandPct": 5.0}, {"slug": "lancaster", "highGrowthPct": 4.5, "year": 2024, "englandPct": 5.0}, {"slug": "pendle", "highGrowthPct": 4.3, "year": 2024, "englandPct": 5.0}, {"slug": "preston", "highGrowthPct": 5.2, "year": 2024, "englandPct": 5.0}, {"slug": "ribble-valley", "highGrowthPct": 4.4, "year": 2024, "englandPct": 5.0}, {"slug": "rossendale", "highGrowthPct": 3.5, "year": 2024, "englandPct": 5.0}, {"slug": "south-ribble", "highGrowthPct": 4.8, "year": 2024, "englandPct": 5.0}, {"slug": "west-lancashire", "highGrowthPct": 3.9, "year": 2024, "englandPct": 5.0}, {"slug": "wyre", "highGrowthPct": 3.6, "year": 2024, "englandPct": 5.0}], "candidates": [{"crn": "07296068", "name": "COMMUNITY HEALTH AND EYECARE LIMITED", "lad": "Preston", "sic2": "86", "unitary2028": "North Lancashire", "series": [{"periodEnd": "2022-06-30", "employees": 234}, {"periodEnd": "2023-06-30", "employees": 393}, {"periodEnd": "2024-06-30", "employees": 519}, {"periodEnd": "2025-06-30", "employees": 655}], "cagrPct": 40.9, "baseEmployees": 234, "flags": ["ons-definition"], "momentum": {}, "basis": "Average employee numbers as disclosed in filed accounts (s411 Companies Act 2006), periods ending 2022-06-30 to 2025-06-30."}, {"crn": "12969380", "name": "EAST LANCASHIRE ALLIANCE CIC", "lad": "Burnley", "sic2": "86", "unitary2028": "East Lancashire", "series": [{"periodEnd": "2022-03-31", "employees": 28}, {"periodEnd": "2023-03-31", "employees": 82}, {"periodEnd": "2024-03-31", "employees": 149}, {"periodEnd": "2025-03-31", "employees": 202}], "cagrPct": 93.2, "baseEmployees": 28, "flags": ["ons-definition", "young-company"], "momentum": {}, "basis": "Average employee numbers as disclosed in filed accounts (s411 Companies Act 2006), periods ending 2022-03-31 to 2025-03-31."}, {"crn": "10624530", "name": "INTALYTIC UMBRELLA LIMITED", "lad": "Preston", "sic2": "69", "unitary2028": "North Lancashire", "series": [{"periodEnd": "2022-02-28", "employees": 41}, {"periodEnd": "2023-02-28", "employees": 41}, {"periodEnd": "2024-02-29", "employees": 38}, {"periodEnd": "2025-02-28", "employees": 191}], "cagrPct": 67.0, "baseEmployees": 41, "flags": ["ons-definition"], "momentum": {}, "basis": "Average employee numbers as disclosed in filed accounts (s411 Companies Act 2006), periods ending 2022-02-28 to 2025-02-28."}, {"crn": "07262043", "name": "INNOX TRADING LIMITED", "lad": "West Lancashire", "sic2": "47", "unitary2028": "South Lancashire", "series": [{"periodEnd": "2023-09-30", "employees": 123}, {"periodEnd": "2024-09-30", "employees": 173}, {"periodEnd": "2025-09-30", "employees": 248}], "cagrPct": 42.0, "baseEmployees": 123, "flags": ["ons-definition"], "momentum": {}, "basis": "Average employee numbers as disclosed in filed accounts (s411 Companies Act 2006), periods ending 2023-09-30 to 2025-09-30."}, {"crn": "09954693", "name": "PROSPERITY CHILDRENS SERVICES LIMITED", "lad": "Hyndburn", "sic2": "85", "unitary2028": "East Lancashire", "series": [{"periodEnd": "2022-01-31", "employees": 33}, {"periodEnd": "2023-01-31", "employees": 49}, {"periodEnd": "2024-01-31", "employees": 55}, {"periodEnd": "2025-01-31", "employees": 138}], "cagrPct": 61.1, "baseEmployees": 33, "flags": ["ons-definition"], "momentum": {}, "basis": "Average employee numbers as disclosed in filed accounts (s411 Companies Act 2006), periods ending 2022-01-31 to 2025-01-31."}, {"crn": "06629923", "name": "JDW CONSULTING LIMITED", "lad": "Blackburn with Darwen", "sic2": "96", "unitary2028": "East Lancashire", "series": [{"periodEnd": "2023-12-31", "employees": 95}, {"periodEnd": "2024-12-31", "employees": 128}, {"periodEnd": "2025-12-31", "employees": 191}], "cagrPct": 41.8, "baseEmployees": 95, "flags": ["ons-definition"], "momentum": {}, "basis": "Average employee numbers as disclosed in filed accounts (s411 Companies Act 2006), periods ending 2023-12-31 to 2025-12-31."}, {"crn": "14396861", "name": "ABLE 2 CARE LTD", "lad": "Preston", "sic2": "87", "unitary2028": "North Lancashire", "series": [{"periodEnd": "2023-09-30", "employees": 13}, {"periodEnd": "2024-09-30", "employees": 41}, {"periodEnd": "2025-09-30", "employees": 64}], "cagrPct": 121.8, "baseEmployees": 13, "flags": ["ons-definition", "young-company"], "momentum": {}, "basis": "Average employee numbers as disclosed in filed accounts (s411 Companies Act 2006), periods ending 2023-09-30 to 2025-09-30."}, {"crn": "06524311", "name": "GEMINI GRP LIMITED", "lad": "Blackburn with Darwen", "sic2": "81", "unitary2028": "East Lancashire", "series": [{"periodEnd": "2022-06-30", "employees": 151}, {"periodEnd": "2023-06-30", "employees": 164}, {"periodEnd": "2024-06-30", "employees": 194}, {"periodEnd": "2025-06-30", "employees": 294}], "cagrPct": 24.9, "baseEmployees": 151, "flags": ["ons-definition"], "momentum": {}, "basis": "Average employee numbers as disclosed in filed accounts (s411 Companies Act 2006), periods ending 2022-06-30 to 2025-06-30."}, {"crn": "11134634", "name": "ASSOCIATED WELLBEING LIMITED", "lad": "Burnley", "sic2": "84", "unitary2028": "East Lancashire", "series": [{"periodEnd": "2022-03-31", "employees": 31}, {"periodEnd": "2023-03-31", "employees": 53}, {"periodEnd": "2024-03-31", "employees": 83}, {"periodEnd": "2025-03-31", "employees": 123}], "cagrPct": 58.3, "baseEmployees": 31, "flags": ["ons-definition"], "momentum": {}, "basis": "Average employee numbers as disclosed in filed accounts (s411 Companies Act 2006), periods ending 2022-03-31 to 2025-03-31."}, {"crn": "09823297", "name": "NORTHRIDGE CARE GROUP LTD", "lad": "Preston", "sic2": "87", "unitary2028": "North Lancashire", "series": [{"periodEnd": "2022-08-31", "employees": 12}, {"periodEnd": "2023-08-31", "employees": 27}, {"periodEnd": "2024-08-31", "employees": 56}, {"periodEnd": "2025-08-31", "employees": 78}], "cagrPct": 86.6, "baseEmployees": 12, "flags": ["ons-definition"], "momentum": {}, "basis": "Average employee numbers as disclosed in filed accounts (s411 Companies Act 2006), periods ending 2022-08-31 to 2025-08-31."}, {"crn": "11208019", "name": "DOMICILIARY HOME CARE SERVICES LIMITED", "lad": "Ribble Valley", "sic2": "88", "unitary2028": "North Lancashire", "series": [{"periodEnd": "2022-02-28", "employees": 12}, {"periodEnd": "2023-02-28", "employees": 28}, {"periodEnd": "2024-02-29", "employees": 46}, {"periodEnd": "2025-02-28", "employees": 75}], "cagrPct": 84.2, "baseEmployees": 12, "flags": ["ons-definition"], "momentum": {}, "basis": "Average employee numbers as disclosed in filed accounts (s411 Companies Act 2006), periods ending 2022-02-28 to 2025-02-28."}, {"crn": "05166983", "name": "I & F LIMITED", "lad": "Preston", "sic2": "78", "unitary2028": "North Lancashire", "series": [{"periodEnd": "2022-09-30", "employees": 17}, {"periodEnd": "2023-09-30", "employees": 25}, {"periodEnd": "2024-03-31", "employees": 42}, {"periodEnd": "2025-03-31", "employees": 76}], "cagrPct": 82.0, "baseEmployees": 17, "flags": ["ons-definition"], "momentum": {}, "basis": "Average employee numbers as disclosed in filed accounts (s411 Companies Act 2006), periods ending 2022-09-30 to 2025-03-31."}, {"crn": "12012624", "name": "SMART CHOICE METERING LIMITED", "lad": "Wyre", "sic2": "64", "unitary2028": "West Lancashire", "series": [{"periodEnd": "2021-04-30", "employees": 76}, {"periodEnd": "2022-04-30", "employees": 95}, {"periodEnd": "2023-04-30", "employees": 110}, {"periodEnd": "2024-09-30", "employees": 191}], "cagrPct": 30.9, "baseEmployees": 76, "flags": ["ons-definition"], "momentum": {}, "basis": "Average employee numbers as disclosed in filed accounts (s411 Companies Act 2006), periods ending 2021-04-30 to 2024-09-30."}, {"crn": "11828886", "name": "BP TELECOMS LTD", "lad": "Blackburn with Darwen", "sic2": "96", "unitary2028": "East Lancashire", "series": [{"periodEnd": "2023-03-31", "employees": 42}, {"periodEnd": "2024-03-3